{
  "version": 4,
  "status": "ok",
  "run_id": "github-30165613180",
  "timestamp": "2026-07-25T16:31:04Z",
  "actions_log_url": "https://github.com/slatedb/slatedb-benchmark/actions/runs/30165613180/job/89698007014",
  "scale": 1.0,
  "runner_type": "warp-ubuntu-latest-arm64-8x",
  "runner_region": "Ashburn, Virginia, US",
  "object_store": "tigris",
  "endpoint": "https://t3.storage.dev",
  "region": "auto",
  "tool": {
    "name": "warp",
    "version": "v1.5.0"
  },
  "benchmarks": [
    {
      "name": "large-put",
      "operation": "PUT",
      "object_size_bytes": 4194304,
      "concurrency": 64,
      "duration_seconds": 30,
      "throughput": {
        "bytes_per_second": 564443111.6661353,
        "operations_per_second": 132.6743897686612,
        "objects_per_second": 134.5737252265093
      },
      "request_latency_ms": {
        "average": 475.298217,
        "p50": 458.248238,
        "p90": 643.91264,
        "p99": 910.479491,
        "min": 195.874512,
        "max": 1335.357054
      },
      "ttfb_ms": {
        "average": 366.292482,
        "p50": 349.524332,
        "p90": 511.809954,
        "p99": 740.948291,
        "min": 137.530614,
        "max": 1280.900059
      }
    },
    {
      "name": "large-get",
      "operation": "GET",
      "object_size_bytes": 4194304,
      "concurrency": 64,
      "duration_seconds": 30,
      "throughput": {
        "bytes_per_second": 1742860953.9348075,
        "operations_per_second": 413.33703613705,
        "objects_per_second": 415.53043274571604
      },
      "request_latency_ms": {
        "average": 153.905219,
        "p50": 143.758889,
        "p90": 213.594456,
        "p99": 352.604034,
        "min": 39.946955,
        "max": 945.513665
      },
      "ttfb_ms": {
        "average": 36.123949,
        "p50": 22.74452,
        "p90": 69.255981,
        "p99": 187.489998,
        "min": 11.638068,
        "max": 565.57393
      }
    },
    {
      "name": "small-put",
      "operation": "PUT",
      "object_size_bytes": 4096,
      "concurrency": 1,
      "duration_seconds": 30,
      "throughput": {
        "bytes_per_second": 17843.90603532053,
        "operations_per_second": 4.356422371904427,
        "objects_per_second": 4.356422371904427
      },
      "request_latency_ms": {
        "average": 229.536317,
        "p50": 205.890763,
        "p90": 338.701699,
        "p99": 809.15811,
        "min": 72.226965,
        "max": 809.15811
      },
      "ttfb_ms": {
        "average": 229.464544,
        "p50": 205.772234,
        "p90": 338.639615,
        "p99": 809.080887,
        "min": 72.169977,
        "max": 809.080887
      }
    },
    {
      "name": "small-get",
      "operation": "GET",
      "object_size_bytes": 4096,
      "concurrency": 1,
      "duration_seconds": 30,
      "throughput": {
        "bytes_per_second": 607553.7465803697,
        "operations_per_second": 148.32855141122306,
        "objects_per_second": 148.32855141122306
      },
      "request_latency_ms": {
        "average": 6.74019,
        "p50": 3.901649,
        "p90": 12.818793,
        "p99": 41.433775,
        "min": 3.410523,
        "max": 419.749022
      },
      "ttfb_ms": {
        "average": 6.63846,
        "p50": 3.856497,
        "p90": 12.716593,
        "p99": 41.007225,
        "min": 3.400846,
        "max": 419.664758
      }
    },
    {
      "name": "small-list",
      "operation": "LIST",
      "object_size_bytes": 4096,
      "concurrency": 1,
      "duration_seconds": 30,
      "throughput": {
        "bytes_per_second": 0,
        "operations_per_second": 12.862918044836457,
        "objects_per_second": 1286.2918044836458
      },
      "request_latency_ms": {
        "average": 77.741177,
        "p50": 50.890991,
        "p90": 149.331399,
        "p99": 296.123047,
        "min": 33.495112,
        "max": 1918.455964
      },
      "ttfb_ms": {
        "average": 77.710763,
        "p50": 50.864497,
        "p90": 149.296782,
        "p99": 296.093068,
        "min": 33.467331,
        "max": 1918.427027
      }
    }
  ]
}
